sent	label
Remind me for a meeting with Sangeetha mob anil kumar	meeting with Sangeetha mob anil kumar
Remainder me 17th November 5:20 pm	Not Found
Hi set a wack up alarm for me at 8 am	Not Found
Remind me today at 7:00 also ok?	Not Found
Do I need internet to be reminded?	Not Found
Remind me to transfer money to N	transfer money to N
Remind me about Yang Feng at 9am today	Yang Feng
Please remind me to purchase a mask	purchase a mask
Concall at 8.14am today. Please remind	Concall
Birthday is on Jan 20. Am I right to select 19 Jan.	Birthday and I right to select 19 Jan
remind me to check the list of urologists in hyderabad tomorrow @ 12:30pm	check the list of urologists
remind me for chque handover to smsc on 29th nov at 11am	chque handover to smsc on 29th
Remind me for movie timing 8:30 pm on Saturday	movie timing
Hi Sayali..is there any limit to how many reminders i can set?	Hi Sayali..is there any limit to how
Set a reminder to watch a movie for today 3 06 pm	watch a movie
Please remind me to take Muzaffar pendrive to office tonite at 9	take Muzaffar pendrive to office tonite
Remind me at 3:55pm today	Not Found
Again one reminder	Not Found
remind me @11:55 am	Not Found
Can u pls tell me how to remove this reminder	Not Found
Remind me to text liz in 15 mins	text liz
What about the reminder I set for 12:30 pm today?	Not Found
Can you please remind me in every 30 mins instead?	Not Found
Please remind me for DA calnders design at 12 pm today	DA calnders design
Can u remind me to catch Indian idol at 8pm tomorrow?	catch Indian idol
I give u 5 stars if u remind me of my name	5 stars if u remind me of my name
Shraddha I need a remainder for my badminton class	my badminton class
Thanks but i'd appreciate if the reminder comes at least 20 minutes ahead of the scheduled time.	comes
Fine it was set earlier but now getting any reminder	Not Found
Reminder on monday at 830 am to carry paaspory.	carry paaspory
and to prepare a flow chart about how to convince president for idea	prepare a flow chart about how to convince president
On 21jan 2017, reminders for CS firm	CS firm
CA I trust on my reminder	CA I trust
Remind me everyday for quess login	quess login
Hey are you remember December 25	Not Found
Hello reminder of CE at 6:35 today	Not Found
Would you be reminding everyone	you be reminding everyone
I just gt ur reminders	Not Found
Can you remind me to do study	do study
I need a reminder on 15th Feb 7:00 pm to check on my CC statement whether FreeCharge has credited 319 amount	check on my CC statement whether FreeCharge has credited 319 amount
Remind me to read ragesh's material after 20 minutes	read ragesh's material
Also set a reminder for next Thursday 1:15 pm, stating that the 'ELECTRONIC WORKSHOP' lab would take place in Nilgiri 104.	stating that the 'ELECTRONIC WORKSHOP' lab would take place
I want to know about shopping	know about shopping
A want to change my schedule	change my schedule
Remind about cash collection tomorrow@ 9.30am	cash collection
Can u please remind me for a checkup visit to the hospital?	a checkup visit to the hospital
U just called me from any number	Not Found
What are todays left over reminders?	What are todays left over reminders
I ve told u to remember on 10.30 am.. now it's 10.53	Not Found
Remind me to go for a walk every evening	go for a walk
I need to edit some photos could you please remind me at 10 am	edit some photos
Can you please remind me my cheques date	my cheques date
Reminder about doctor	doctor
Tell me about apple iPhone 7 and 7	apple iPhone
Can you tell me my pending reminders	pending reminders
Please remind me to send email to SM tomorrow at 9:30 Am	send email to SM
How you will remind	How you
you literally just set a reminder to kill myself	kill myself
Hi can you remind me to pick my laundry	pick my laundry
Can i know how to delete the scheduled remainder	Not Found
Hey can you remind me to put my calculator in my bag	put my calculator in my bag
Just remind me before 4 that is my 3 o'clock that I have to take something before leaving my home ok	take something
Can you give countdown reminders	give countdown reminders
And remind me to book a tattoo appointment at 3	book a tattoo appointment
Reminder me for boating in river	boating
I need u to set a reminder for me plz	Not Found
Call me on 9558417661	Call me
Pl remind me at 2:00 pm to send a mail to Ms Pragti regarding roasted chana	send a mail to Ms Pragti regarding roasted chana
Reminder to attend a function of CS- deva mohapatra on 17-01-17 evening 6pm	attend a function of CS- deva mohapatra
Remind me tomorrow evening 6.00 pm to take pic of moon	take pic of moon
Can you please remind me at 7.45 am tomorrow to take my boliter suit	take my boliter suit
Please remind me tomorrow at 11 for calling coaching centre	calling coaching centre
Tell me about new year parties in Pune ?	new year parties in Pune
Remaind me to take my process books today to office by 8:45am and even about Pendrive also	take my process books and Pendrive also
Remind me to use my haptik balance before it expires	use my haptik balance
Hi can I have multiple reminders listed.?	Not Found
Remind,me at 11am tom to write mom and email from fda	write mom and email from fda
Can you remind me for food	food
Pls tel me what all reminded u hav for me ??	hav for me
Pls remind me in another half hour	Not Found
Hey Leena .... Give me a call in half an hour	Give me a call
Call me 10 times at every 5 min	Call me 10 times
Remind me to go to school on 15 november 3 pm	go to school
Please remind me for dental check up today at 7pm	dental check up
Remind me tomorrow about campus drive	campus drive
How will you remind me	How
3.30 pm. Meeting kalpaj choudhary	Meeting kalpaj choudhary
General reminder at 8.30 am sunday	Not Found
remind saying movie at 8:00 pm	saying movie
Please remind me of buying the air ticket at the same time	buying the air ticket
Pls remind me to keep the documents of Ram sanjeevan new case for tomorrow @9 pm tonight	keep the documents of Ram sanjeevan new case
Reminder time upto 10PM	Not Found
Yes remind me everyday	Not Found
Can you please remind me to go to CNMS at 9:50	go to CNMS
Remind me to take nail cutter at 22.00 tonight	take nail cutter
Remind me on 17 dec its my best frmd deeps bday	deeps bday
please remind me after 11am-10pm would it be ok	Not Found
Remind me....daily.....	Not Found
I'll ping in some time	Not Found
I would like to add one more reminder	one more reminder
remind me to sleep after 10 mins	sleep
I want this reminder everyday	Not Found
Date: November 18, 2016 Time: 11 35 am Name of Person: Call gurpal of mahindra & mahindra	Not Found
how to put sound for reminder	put sound for reminder
Remind me tommroe at 8:50 pm about movie on star plus	movie on star plus
Remind me my gym time everyday	Not Found
Hi please remind me tomorrow for invitation card	invitation card
Hari Krishna 18 December	Not Found
Set a reminder to inform about the BBPL cricket match today.	inform about the BBPL cricket match
Remind to pay TDS for the latest floor slab	pay TDS for the latest floor slab
Remind me to apply for the VP Engineering post at Haptik this weekend	apply for the VP Engineering post
Reminder to recharge at 7pm today.	recharge
9.00am	Not Found
Alarm every morning except friday at 8am	Alarm
Reminder to purchase ropes, cartons, scrub for new apartment today at 7.15 pm	purchase ropes, cartons, scrub for new apartment
Can you setup a reminder to buy gift for my wife on 14th of this month.	buy gift for my wife
Tomorrow at 6pm remind me to fell EBC form	fell EBC form
Thankyou for reminder	Not Found
"Hi. Set me a reminder ""support pipeline"" every Friday at 10 am"	support pipeline
remind me to kill myself	kill myself
Bad reminder. .	Not Found
Can you please remind me the same thing in the morning 10?	same thing
Ankit gupta His bday is on 2 January	Ankit gupta His bday
Reminder to msg fariya	msg fariya
Ki muhje 5 bajne pr ek reminder chahiye	pr ek reminder chahiye
Thank you for the reminder. Hdfc CC is paid.	Hdfc CC is paid
Can you remind me in 15 mins from now..??	Not Found
how to set a daily reminder	Not Found
Good morning :)	)
I have set few reminders. For now I need them only. I'll let you know in case I need something else.	let you know in case I need something else
Pls also remind me to give 5 nominations for elections	give 5 nominations for elections
Remind me at 7 pm for Zym	Zym
Remind me around 4 that I have to book appointment at madona	book appointment
Is it possible to schedule for daily	Not Found
Thanks for your reminder!!!!	Not Found
Hi can you remind me to kill my manager in the second half	kill my manager
Remind me 4:30 to send the person at jain marble today	send the person
I just wanted to check the alarm	check the alarm
Yes on my way thanks for multiple reminders	Not Found
Reminder for ticket booking at 10.45 AM	ticket booking
Alarm for 11:13	Not Found
9.3	Not Found
Tomorrow at 1:00 pm remind me to take my pouch 👝 from lab	take my pouch
How about your day?	How about your day
Good morning vandana	Not Found
Id prefer if u text rather than call	text rather than call
Can you help me how I could set DND mode on my phone?	DND mode on my phone
Remind me on Tuesday again same	again same
I have a shopping list to be reminded at 6.40 pm	Not Found
8898749979	Not Found
Call clamp on ufm on monday	Call clamp
Please set a general reminder at 11.00 am, 12.00 noon, 2.00 pm,4.00 pm ,5.00 pm and 8.00 pm	Not Found
Shraddha you remember me I am Sunita I fight it to you because you were just talking me so rudely and deleted your app I downloaded it again you remember me	Not Found
Please schedule reminder to go to floor at 9.22 P.m today	go to floor
Remind me to wash my hair every after 2 days	wash my hair
Remind me to catch traine tomorrow at 10 pm	catch traine
Yes please remind me but in every 3 hours	Not Found
"Set a reminder to this number 7200034149 at 4am.""study"""	this number 7200034149 and study
Thanks for reminding me....	reminding me....
Set a reminder to watch the football match on saturday 6 pm	watch the football match
Can yu give me information about	give me information about
One more reminder please	Not Found
Remind me to take tabs from medical	take tabs from medical
Remind me for courier of draft to papa	courier of draft to papa
Bt how many reminders can I set at a time????	Not Found
I need multiple alarms	Not Found
VAT payment reminder	Not Found
Can you call for this	Not Found
Call me nw fr 5 minutes	Not Found
Pl set reminder after 20 min	Not Found
YA.... but I got morning to till evening reminder just.... so I asked	Not Found
Hey remind me at 3 to send my details to dr mukherjee.	send my details to dr mukherjee
Remind me today at 5:25 pm to visit the lawyer	visit the lawyer
Remind me to book ticket after 5min	book ticket
Remind me to give my friends earphones at 6:40	give my friends earphones
Remind me to get the bottles at 9 p.m. today	get the bottles
Remind about vendor for fascade at 11:15 am today.	vendor for fascade
Remind me to take new register	take new register
Title should be remind to collect cricket match tickets	collect cricket match tickets
So what my schedule	Not Found
When ever there is any contest or anything related to photography on social media or any where I Must know about it.	any contest or anything related to photography on social media or and about it.
Yes How can I set a To Do List	Not Found
It's too late reminder	Not Found
Remind me to see dhruvs travel job	see dhruvs travel job
Can you please remind me that I need to pick up my younger sisters from dance Institute and the timings 6 20 pm	pick up my younger sisters
So now I have 2 alarm scheduled, right?	Not Found
Ok Remind me @7 that i need to make Daily revenue report DND Report Login time report	make Daily revenue report DND Report Login time report
PL remind me again @ 9:40pm today	PL remind me again
Can u pls remind me once one plus 3T - 64gb is available in amazon	64gb is available in amazon
Can I get a call at 9.30 everyday?	Not Found
Remind me to leave for the railway station at 6	leave for the railway station
Please remind me after 28 days that my data will expire	my data will expire
Siddharth, remind me tomorrow to go for movie at 6:45	go for movie
Thnx manal. ..Can u plz remind me the same at 10pm tonight ?	Not Found
Can u remind me my task daily @9.30 a.m	Not Found
Yes sure	Not Found
I needed a stronger reminder	Not Found
Will you remind me for apply face wash for daily at 11:07 am and 06:03 pm except sunday	apply face wash for daily
Can u send send the list about the ATM and money withdrawal?	the ATM and money withdrawal
Thnkew for d call i really appreciate it.	appreciate it
Set a reminder	Not Found
Please set up a reminder for 31st Dec 2016 for me to resume back to Whats App and reactivate Facebook.	resume back to Whats App and reactivate Facebook
I would like to know about you...?	like to know about you...?
Please schedule for daily	Not Found
Whenever I need help I will tell you...	help I will tell you...
Hey, can you remind me to wish someone on their birthday?	wish someone on their birthday
Ur nt reminder to morning 😢	Not Found
Remind me to collect cheque after 10 days	collect cheque
Remind me in the morning at 9AM	Not Found
Remind about Sri vidya at 4 pm tomorrow	Sri vidya
Please remind me to transfer money to my friend's account..	transfer money to my friend's account
Remind me to get pics	get pics
Call me after every 5 minutes three times atleast please	times atleast
Please remind me to watch nat geo channel today at 9 pm.	watch nat geo channel
Thnk u fr reminders.	Not Found
Hi could you tell me if I can put a reminder which opens a website on a scheduled time?	which opens a website
Bro call me at 6:00 pm today	Bro call me
Hey remind me tomorrow morning at 9:30 am to make city bank credit card payment	make city bank credit card payment
Do we need WiFi or mobile data on for remainders?	Do we need WiFi or mobile data on for remainders
tomorrow at 8 pm remind me to take my samsung head phone back	take my samsung head phone back
Reminder watch UFC	watch UFC
Hi Shraddha can u set a reminder to ping me around 6:30pm to go to Wellness and speak to Fitty?	go to Wellness and speak to Fitty
Change reminder	Not Found
Remind me tomorrow for laundry	laundry
Set my another reminder every day	another reminder
Remind me to put in download at 11pm today.	put in download
Can I have reminder calander for all mnth	calander for all mnth
Please remind after one hour...	Not Found
Remind me to finish my project by 4pm	finish my project
Remind me to take b estate tomorrow	take b estate
Remind me to buy macbook today at 2:51 pm on 9049961794	buy macbook
Already I set morning remainder	Not Found
Remind me to go to 232 at 9:30 pm tday	go to 232
Can you tell me a software for windows laptop which has following features 1. Data feeding with due dates, reminders 2. One click pending task lists; in addition these will help me more i.e. sharing task either thru mails or on lan. These were the essential features which I require.	Not Found
Meeting Reminder Date: November 10, 2016 Time: 6 00 PM Meeting with: raja Venue: library	Not Found
Also put 1 more reminder - Pay 6000 to sajid	Pay 6000 to sajid
Remaind me November 10th 2016 at 10am	Not Found
Can you please tell me what reminders are set for me ?	what reminders are set for me
Remind me to cover the whole topic of civil	Not Found
Please set reminders from 6 PM to 3 AM	Not Found
9011523330	Not Found
reminder at 6.30 am and 6.35 am today	Not Found
you were supposed to remind me yesterday 8 pm	Not Found
Set an alarm every morning at 8am?	Not Found
Hey please remind me to leave office by 4	leave office
28th night remind	Not Found
Thanks for your reminds	Not Found
remind me on 17th to go for voter id on 18th nov	go for voter id on 18th
Ok lets set up wat to do list	Not Found
Should I switch on my net for reminder	Should I switch
Remind me one day before	Not Found
Can u remind me on 1.55pm	Not Found
Reminder to set	Not Found
Remind me book a fight ticket(Dubai to chennai) before Wednesday	chennai)
I want reminder	Not Found
Remind me to fill the RBI form on 23rd at 8pm	fill the RBI form
Can u make a call for me?	Not Found
Hi... I want to edit my reminder	Not Found
Can u get a call half n hr before	Not Found
Will something remind me to eat time to time	eat time
is it possible to schedule on every sunday??	possible to schedule
What reminder is this???	What reminder
Want a everyday reminder at 3.00 P.M and at 8.00 P.M to massage pressure points on body.	massage pressure points on body
Remind me my darlings birthday which is on July 29	my darlings birthday which
Reminded me for 1102 flat painting with krishna	1102 flat painting with krishna
Remind me to buy apples in 5 minutes	buy apples
Remind to transfer money in Karnataka bank	transfer money in Karnataka bank
How to delete this remainder	delete
Schedule those from tomorrow	Schedule those
Remind me to wish Paushali on her birthday -25th Dec	wish Paushali on her birthday -25th Dec
I'm sure is that day so remind me to find out the exact date tomorrow	find out the exact date
Is this one day reminder or everyday reminder?	Not Found
Please remind me tomorrow at 10:45 am to check if Mr.NP Acharya's cheque book has been sent back to the branch.	check if Mr.NP Acharya's cheque book and been sent back to the branch
Remind me to take dark chocolate to office	take dark chocolate
Egg reminder	Not Found
I want to set up alarm ....2 min baad kaa	set up alarm
Time to make your to-do list shorter, Alex! TASK - Cam and Bill payment reminder today at 2 pm	- Cam and Bill payment reminder
Remind me to issue cheque on 5th Dec for credit card payment	issue cheque and credit card payment
Can you set up a reminder for me?	Not Found
Remind me to study forum ias tomorrow 8pm	study forum ias
Remind me to take my stethoscope at 12:30pm today	take my stethoscope
Sorry send by mistakenly	Not Found
Supermoon reminder tonight	Not Found
I would like to set a reminder	Not Found
remind me this for booking... mention it's for booking	booking... mention it's for booking
Remind me i have a movie show booked for ten pm on Wednesday. Remind me at 2 pm and six pm on Wednesday 4th jan	movie show booked
Plz set a reminder on 9th Nov 16 regarding mom's blood test 5pm & 10th Nov 16 9:30 am for the same.. Thanks	Not Found
Remind me at 9:40 to book my train ticket	book my train ticket
Pls remind me to take photographs and cheque leaf today evening by 8pm.	take photographs and cheque leaf
Can you integrate my calendar with reminders	Not Found
Remind about narration to be given to and company on 10th dec at airoli	narration to be given to and company on 10th dec
Yes , that means after one hour remind you	means
U need internet connection for reminder	internet connection for reminder
Hi. I want to set up a reminder	Not Found
please infrom me about cricket match at 2 pm	cricket match
I want to set an reminder of 8.45pm daily to pick my charger	pick my charger
Can u remind me of my classes	my classes
do call me in d morning at 6.10am	Not Found
Set at 7:20 and 7:30 pm today	Not Found
Can you schedule the alarm every day?	Not Found
Remind me for movie 2 pm	movie
What was the reminder set for at this time?	Not Found
How will you remind me???	How
Reminder only in working days pls	Not Found
u called me tdy kya	Not Found
hi please set a consecutive reminder as on 6 AM, 6:30 AM & 7 AM 14th november 2016	Not Found
Remind me to remove the milk from the heat after 10 minutes	remove the milk
Sincere thanks for continuous reminder	Not Found
Reminder of lic policy	lic policy
Kindly remind me on 30th Nov	Not Found
You can close the reminders hence forth	Not Found
Thank you for remind me at early morning	Not Found
Remind me to wash my hair this evening at around 7:30 p.m., please.	wash my hair
Remind me at 11:30 am for connection of telephone	connection of telephone
Hey remind me at 1 pm to check white jigar bag	check white jigar bag
Re. Schedule the alarm at 8 am daily	Schedule the alarm
Remind me 2 times. Once at 9 AM n again at 6 PM	Not Found
Remind me to do the reports.	do the reports
Also remind me about the bank work tomorrow morning at 9:15 am	the bank work
Remind me to check with bikash on indus ind bank	check with bikash on indus ind bank
Remind me to book tickets on 25 January for 25 may at 9 am	book tickets
I want to set one more reminder	Not Found
Please call me in gap of 3 hours	Not Found
Remind at 5.30 pm today to email Kshitij medical cards	email Kshitij medical cards
Remind me today at 5.45 pm to meet engineering works	meet engineering works
Set the reminder for 6 P.M	Not Found
Same reminder at 5.10 pm tomm.	Not Found
Remind me tomarrow morning 9:30am to collect my bag to office	collect my bag
I haven't set any reminder	Not Found
Tell me about yourself	yourself
Can u set me a reminder?	Not Found
Thanks for asking	Not Found
Remind me aftr 2 hrs	Not Found
Set me a remainder at 1:30 pm today	Not Found
Pls remind me	Not Found
Reminder for shopping on mantra at 8:30 pm	shopping on mantra
Plz remind m tom mrng for dr appointmnt and car service	dr appointmnt and car service
In Transit: Just a reminder that your product ayeshafashion Twin Pew... with order id OD507673407676070000 is on its way and will reach you by Tuesday, 29 Nov'16. Track your order here http://fkrt.it/8ZtckTuuuN	product ayeshafashion Twin Pew... with order id OD507673407676070000 and Track your order here http://fkrt.it/8ZtckTuuuN
Remind me about it at 6pm today	it
Also remind me on coming monday that i have meeting with jukaso manager at 11 am	meeting with jukaso manager
Plz set a reminder for me at 10 PM today for management hours	management hours
Can u remind me 9 to 12 midnught	Not Found
Reminder for 940 pm today to get milk	get milk
Remind me to ask akhil sir about one time cost excell sheet about renovation of office to be send to VG Sir	ask akhil sir about one time cost excell sheet about renovation of office to be send to VG Sir
Pls repaet of this reminder on 5 pm today	Not Found
I need to get a sound notification also to draw my attention to the reminder	get a sound
Alarm pls	Not Found
Remind me For the Same On 5	the Same
Have u checked that about abacus classes..	Have u checked that about abacus classes
And if i donot repond, Can you please call twice?	Not Found
Change reminder timing	Not Found
Please remind to take t-shirt on 5th Jan at 7:55 am	take t-shirt on 5th Jan
Remind me to take books	take books
But you haven't reminded me	Not Found
Plz notify me by calling me	calling me
Call me at 5:50 pm today	Call me
Meeting Reminder Date: November 23, 2016 Time: 8 15 AM Meeting with: C b	Not Found
Set reminder for me	Not Found
Morning remember me at 8.am i should go to swamy home and get fittings 10/11/2016	go to swamy home and get fittings 10/11/2016
Remind me each hour	Not Found
Remind me about cheque payment	cheque payment
Remind me to meet hi top 4 touch doctor on 6th January morning 5 am	meet hi
You can remind to my friend?	Not Found
Remind me about jesah's birthday on 24 November	jesah's birthday
Tanu birthday on 14th May...Please remind me every year	Tanu birthday
nd give me meeting reminder also today i wanna go meet my my gf at 3 :30 pm	meeting and go meet my my gf
Now I am watching movie so remind me after 3.30pm	watching movie
Give a reminder after 20 min plz	Give a reminder
Thanks fr ur reminders	Not Found
Name: श्रीkant राthi Date: 21-06-2017 Time: 11.50 PM	Not Found
Please set an alarm at 3:00 pm today.	Not Found
Give me a call at 9:30 for whizible	Give me a call and whizible
5 o'clock in the evening i would like to take photos..... So plz reminder me	take photos
One more task schedule please	Not Found
Now when i get reminder	Not Found
Hi please set a reminder	Not Found
Thanks suman for the reminder	Not Found
Kindly remind me to book return ticket for holi	book return ticket for holi
Reminder for samples in tomorrow morning 9 am	samples
And then remind me for college at 2:30	college
Remind me to Read sohels article	Read sohels article
Can you schedule it from 10:00 am to 10:00 pm.	Not Found
Remind me dentist appointment	dentist appointment
Give me a reminder tomm at 12 pm fr a meeting at airoli	meeting
Remind me to go for driving school at 8:50 am	go for driving school
Call to professional courier at 11 am	Call to professional courier
Remind me about pan tomorrow @9.30am	pan
N set 10 days reminder in December also	Not Found
Pls reschedule this reminder for every 2hrs.	Not Found
Yes please remind me :)	Not Found
Have you set reminder	Not Found
Hi... I have to go for a meeting on 16th of this month early morning... need a reminder for the same on 15th	go for a meeting
Also can you schedule the same at 11.30 as well	Not Found
The reminders werent times properly.	Not Found
I want to change my alarm tune	change my alarm tune
Remind me to go to Library at 7 am today.	go to Library
Can you set this to do for daily?	do for daily
Hey can you change the timing of this reminder to 9 pm ?	Not Found
I want meet to sanju please remind me	meet
Could u repeat the reminder details	details
Can u set me a reminder	Not Found
Remind me about cheque deposit tomorrow at 10 am	cheque deposit
Is it set for all days??	set for all days??
Hi..Please remind me on 14th November,2016 (Monday) morning at 10 am to start to office at 1pm	start to office
Grwat. thanks for the reminder :)	Not Found
Remind me to make class notes ofter one minute	make class notes
Wish Birthday Name: Ritama Date: February 7, 2017 Time: 12 00 PM	Not Found
Call Mrs. Tayde at 4pm today	Call Mrs. Tayde
Remind me to send a thank you message to dr Rohit tomorrow	send a thank you message to dr Rohit
Will i get reminder on 27th night 11:55?	Not Found
Hey drop me a reminder for a class on thrusday 5.30pm	a class
Now I can remember	Not Found
Hi good evening haptik Plz remind me to go shopping	go shopping
Set reminder for monday for filling timesheet	filling timesheet
Set morning alarm	Not Found
