sent	label
I want to know about haptik services charges	about haptik services charges
Remind me to write a cheque today at 10:34 pm	write a cheque
Ya u can	Not Found
16 January 12 o colok	Not Found
Topya collect at 10.30 pm today reminder	Topya collect
How you remind me?	Not Found
I want to know about microwave oven	know about microwave oven
Make a reminder of 3:00pm for today	Not Found
I called thank you	Not Found
Set an alarms for 9 am also	Not Found
Hey	Not Found
Remind me every two hours	Not Found
Remind me to finish my exam by tonight	finish my exam
Remind me to bring sm personal stuff	bring sm personal stuff
reminder to wakeup	wakeup
Hey,could you please set the alarm for 3 instead of 2	Not Found
Pls remind me to buy glue stick at 5pm today	buy glue stick
remind me everyday	Not Found
Hey Shruti ...Remind me to ask my mom for green set tomorrow @10am	ask my mom for green set
Hey shraddha can you set a reminder at 6:00 PM 29dec for me? ☺️	Not Found
About the appointment	the appointment
To do	Not Found
today at 10 am remind me to mr.button	Not Found
Plz help me i dnt know....any things	i dnt know....any things
remind me at 3	Not Found
Tell me my reminders	my reminders
Hey pls set the alarm to 4 30 am	Not Found
Zahra, do i have to make this reminder for each day?	Not Found
"Just remind me on this Saturday, at exactly 10 pm with a keywords ""Maslow's life map"""	Maslow's life map
Remind me after 15 minutes	Not Found
Remind me to get ready for airport	get ready for airport
Can you please remind me to take eggs in the evening at 7:30	take eggs
Reminder at 4	Not Found
Another daily reminder pls	Another
Reminds me	Not Found
Remind me to forward resume at 10:30 am today	forward resume
I just feel so sleepy.. thanks for reminding. :)	reminding. :)
I need to set 2 wakeup reminders	wakeup reminders
I want a reminder	Not Found
Remind me to alert for writing paper of blind person. At morning 8:30AM	alert for writing paper of blind person
Remind me to collect thermometer	collect thermometer
Remind me to wish Utkarsh Pandey happy birthday on 2nd August at 1 pm	wish Utkarsh Pandey happy birthday
Tanx fr remainding	Not Found
list of reminders	Not Found
Remind me to get the transcripts for USC at 9 am on 9th December	get the transcripts for USC
Make a reminder for me ever month 21st date Timings : 2pm	Not Found
Sorry schedule at today	Not Found
By what means ? Calling or something else	means and Calling or something else
Can you also remind me to pay all the monthly bills at 10 30 this morning	pay all the monthly bills
Meeting Tom at 11 am at vikrant studios	Meeting Tom and vikrant studios
Can you set up this alarm in 4 times?	Not Found
Remind me to on my washing machine after 45 mins	on my washing machine
Naahb thnx	Not Found
Remind me to buy umbrella	buy umbrella
But kindly remind me at 9:30	Not Found
Cancelll that reminder	Not Found
2 remainders plzz 1 at 6 and another at 6.30 am	another
Remind me to take print outs at 620 pm today (November 26)	take print outs and (November 26)
Please remind me about my exam on 19.12.2016	my exam
Hi ! Remind me everyday to mark the attendance at 10am and at 12pm	mark the attendance
Can you now list all the reminders for me for tomorrow	the reminders for me
Check tasks. Remind me at 11 am today	Check tasks
Hi please remind me to arrange for tomorrow at 12.15 noon today	arrange
Pls give me a ring, instead of message	Not Found
Please change this Friday morning alarm to 2 pm in afternoon	Not Found
Make the reminder to one hr	Not Found
Just message is enough for remainder	enough for remainder
Hi remind me about making thank you cards at 3.00pm	making thank you cards
OK	Not Found
Can you set this reminder everyday	Not Found
Hi, I need your help with a list I intend to complete your	complete your
Can u erase all my reminders?	erase all my reminders
Can you set alarm for me	Not Found
Remind me to post letter to sbi at 6:35pm today	post letter to sbi
Remind me about sending an offer to UNN sugar	sending and sugar
Can you remind me on 29th night	Not Found
can yu make one more reminder plz?	Not Found
I wished my dad manaal...thanks for reminding☺	Not Found
Gayathri 3/1/17 5.08	Not Found
Remind me to wish Sumit on 27th Jan at 11 am	wish Sumit on 27th Jan
Yes thanks	Not Found
Hey team haptik.. Want to schedule a reminder every Wednesday's and Monday's at 11:00 am for follow up mail	follow up mail
Set rememinder on 22nd November morning around 9 am	Not Found
I wish to unsubscribe from the reminders	unsubscribe from the reminders
Remind me to eat Nutella and roti at 3:11 yoday	eat Nutella and roti
General reminder	Not Found
Remind me to check results of LIC housing finance on 16th Jan	check results of LIC housing finance
Remind me to study at 12.10pm today	study
Hi thank you for call	call
Please remind me on Saturday 10th to meet the auditor	meet the auditor
Reminder for friend birthday celebration	friend birthday celebration
Then you remainder me 2pm to tell to go lunch	go lunch
I want to set a reminder for Monday to Friday every week at 10:55 am	Not Found
Missed 1, thanks for reminding	thanks for reminding
8.3	Not Found
To you know some game hacking applications? Without root	you know some game hacking applications? Without root
Remind me to Study Data Structures. Completing Computer Networks Nd Questions on 10th nov 7th o.m	Study Data Structures. Completing Computer Networks Nd Questions
Remind for meditation	meditation
By a call please	Not Found
Daily you can remind to this time	Not Found
Dnt remind me every hour	Not Found
Please remind me to get my laundry at 7pm today (November 25)	get my laundry
2nd jan remind me wish dad b day 8am	wish dad b day 8am
Remind me to play football	play football
Still I'm getting phone calls from HAPTIK	getting phone calls
Remind to check on my car battery tomorrow at 11 am	check on my car battery
Can you wish birthday for me?	Not Found
Set daily reminder except Sunday till 6 Jan 17 at 2:30 pm for class	class
Can u remind me this after 15 mins	Not Found
Remind me to buy eggs on next Monday and Tuesday at 8 pm	buy eggs
Should I need to turn on my wifi....for reminder	turn on my wifi....for reminder
i need a wakeup alarm	wakeup alarm
Remind mee	Not Found
Meeting Reminder Date: November 15, 2016 Time: 3 55 PM Meeting with: Madhavi Venue: Matterhorn	Matterhorn
Can just send me a normal reminder	Not Found
Pl call me a day in advance	Pl call me a day
Hey can u remind via text message?	via text message
Please set a reminder of a birthday on 27 January of my sister Priyanshi(Babua Chacha's daughter)	a birthday and sister Priyanshi(Babua Chacha's daughter)
Remind me about Stand Up at 4.54 pm from Monday to Saturday.	Stand Up
Remind me to unlock magical chest at 3pm tomorrow	unlock magical chest
can u pls set a reminder	Not Found
I did it perfectly Thanks for the remainders Shruthi	the remainders Shruthi
Remind me to send bank account details to hyd Tenant today	send bank account details to hyd Tenant
Remind me to go collect my marksheet from college	go collect my marksheet
Remind me on 31st night 11:58 pm To see my mardhal pic and to think about my god (narsimha swamy) namam	see my mardhal pic and think about my god (narsimha swamy) namam
Remind me to read a book - cs6 Dreamweaver at 2 pm tomorrow	read a book - cs6 Dreamweaver
Also remind me on Monday 13th Feb the same Tnx	Feb the same Tnx
Can u remind me at 11:45 pm today	Not Found
Kis kam ka hai reminder	Not Found
Can u add this reminder for every 14th day of month?	Not Found
Thanx for reminder Haptik.	Not Found
Reminder of what	Not Found
Tell me something about yourself	something about yourself
Can you set this reminder for every day	Not Found
Schedule meeting on Wednesday at 9.00 morning for Environmental change and sustainable development	meeting and Environmental change and sustainable development
will this reminder work offline...?	work offline...?
i din receive the reminder	Not Found
Remind me to get tripod from Siva Saran tomorrow by 12.40 PM	get tripod from Siva Saran
How wil u Remind	Not Found
Can you set a office leaving reminder for me	Not Found
Call sajal . Afternoon.	Call sajal
I will wish my frnd on 5 30 plz remind me	wish my frnd
Remind me to have a photograph tommorow at 11 pm	have a photograph
Dude you reminding me at 12:51	Not Found
8:00 am	Not Found
Please remind me in 2 hrs	Not Found
please remind me to speak with advaita tonight	speak with advaita
kindly remind me of one mor brthday	Not Found
Remind me tomorrow to get my laptop repaired at 6: 00 pm	get my laptop repaired
hi sachin do u remember	Not Found
Gym Reminder	Not Found
Can you change the reminder to every 2 hours please	Not Found
Please remind me to take cash before I leave for office	take cash
Remind me too do honework :3	do honework :3
Whatkind of reminder services do u provide	services do u provide
Can u remind me at 8:00 am in the morning to finish my notes of CT	finish my notes of CT
Is it possible to put in a reminder for every 15 days pls?	possible to put
Need to ask Nandini to organise a cotton pillow. Please remind me at 945am on 24 December. Thanks.	ask Nandini to organise a cotton pillow
Wish Birthday Name: Subha Date: December 22, 2017 Time: 1 50 pm	Not Found
And also can u remind me to buy sweet tomorrow for courier to send someone	buy sweet and send someone
Tomorrow remind to hand over a cheque to Prashant Nahar!	hand over a cheque to Prashant Nahar!
But you were 3 hours late reminding me.	late reminding me
Remind me tomorrow at 4pm to meet Raj Nayak.	meet Raj Nayak
Hey I want to set my own time table pls help me	Not Found
Pls remove the alert	Not Found
Meeting Reminder Date: November 29, 2016 Time: 10 30 am	Not Found
Can U remind any object snooze	any object snooze
Create a reminder	Not Found
Remind me to switch on the machine in 10mins	switch on the machine
Call dr chaurey at 6pm today	Call dr chaurey
Remind me on something else	something else
Also can you remind me in 1 minute for test	test
Can you pls remind me every Friday to fill my Timesheet?	fill my Timesheet
Can you remind me every time there is a Real Madrid match?	there is a Real Madrid match
Remind sujit sir about reading 2 contracts	sujit sir about reading 2 contracts
Set reminder for today 12 pm download song ek ajnabi hasina se advertise	download song ek ajnabi hasina se advertise
And please provide me with a diet schedule in which I can loose 10kgs	Not Found
Can I edit the reminder	Not Found
Remind me at an interval of 4 hrs	interval of 4 hrs
Thnx srijan for ur reminder	Not Found
Reminder 2 soak almonds at 9pm everydy	Not Found
Remind me to go in floor mill in 2 minutes	go in floor mill
remind me to pay vodafone bill	pay vodafone bill
Please remind me about Friday meeting one day before on Thursday. At 6pm	Friday meeting
Remind me to talk to vartik at 8 pm today	talk to vartik
I want some videos about Studies	videos about Studies
hlo	Not Found
Can u just remind me on 9 pm	Not Found
Hello yesterday i gave message to remi d me at 11 a.m. and you remind me at 11.p.m. please be carefull	remi d me
So can u repeat all the alarms I set ?	repeat all the alarms I set
Schedule for next 5 days.	Not Found
Hey can u remind me this task tomorrow at 10 am	Not Found
Remind me from 12pm	Not Found
Please call me at 2 need tp call Honey	tp call Honey
Also remind me to text Hameed at 5 pm today	text Hameed
What about task name or task activity to be reminded?	What about task name and be reminded
Need to bring cheque book tomorrow. Reminder at 10 pm tonight	bring cheque book
I need to be at Kaadhambari by 2 pm today please remind me at 1 pm	be at Kaadhambari
Yep u can, i would like to know if there is an easy way to remember the names of the CMs of all states in India	like to know if there is an easy way and CMs of all states
Can u change my reminder timing to 1 pm plz	Not Found
This is exan time for me, so i want like exam alarm	exan time for me, so i want like exam alarm
To remind me at 11.30 today for bday	remind me at 11.30 today for bday
Remind vishal about bank at 9.00pm	Remind vishal about bank
Please remind me to take the laundry	take the laundry
Nope set it on today	Not Found
Ya remind me for my mother's birthday gift remind me daily till 5 th jan at evening 6 pm	my mother's birthday gift remind
Can you please schedule it for every day?	Not Found
Please cancle all my alarms	cancle all my alarms
Remind me to walk	walk
At 9:00am i want a reminder , plz	Not Found
Hey reminder for a cookery class on wed 1 to 4 remind me at Tuesday evening 9pm and wed morning 10am	a cookery class
Remind me to attend chirags house warming ceremony for Sunday on Saturday night	attend chirags house warming ceremony for Sunday
Will u manage a alarm at 12:32 pm today??	manage a alarm
Pls remind me to take dad's pension file at 9 am tomorrow morning	take dad's pension file
"Topic of reminder is ""question paper for vashu"""	question paper for vashu
For Watelse cn i set d reminders?	Watelse cn i set d reminders
I need a specific subject for the reminder	Not Found
Set a reminder for ne	Not Found
Can you call me now I am stuk in some where..	where
Remind me on January 2017 to start RD Remind on Jan 1st	start RD
Missed ur call	Not Found
Hiring staff reminder at 1 pm today	Hiring staff
But can you call at 91 9016804611 number?	Not Found
Friends are coming remind me at 12.30 pm today	Not Found
Do I hv ny remindrers scheduled?let me know	Not Found
Remind me @3:00pm to go bank	go bank
Remind me from tomorrow onwards	Not Found
Can you remind me 10 o'clock am	Not Found
"Plz remind me as ""NC-OBC """	NC-OBC
Remind me to have my protein at 1230 pm	have my protein
How can i set for payment reminder	Not Found
Remind me to talk to my driver about my license tomorrow at 5 pm	talk to my driver about my license
Ye sure	Not Found
Plz remind me tomorrow 9:00 Am to download video in conflict management	download video in conflict management
Cal me to remind	Not Found
M getting reminder of what every mrng 3:10?	Not Found
Can you remember me to take bath at 10.30	take bath
I need to buy a travel bag pls give a reminder	Not Found
Can you remind me today also just like before. ?	Not Found
Can you call to my	Not Found
I need a reminder everyday at night 11	Not Found
Do you still remind me if I am offline	Not Found
Remind me to sleep at 11 pm	sleep
Please add to purchase duct tape for today's 7.15 pm reminder	purchase duct tape
Remind me to take my passport & tickets on 25th November morning before i travel out	take my passport & tickets and i travel out
Reminder me	Not Found
Remind me tomorrow to complete some documents and to do my official work..	complete some documents and to do my official work
Could you delete my alarm for whole month of Jan	Not Found
Hm	Not Found
Thanks for the call	Not Found
But u should do something like someone talk like on call	do something like someone talk like on call
Reminder to study at 11 am tomorrow	study
The reminder time is 11pm	Not Found
Nothing for now... Let u know later	Nothing
The reminder was for 6 pm	Not Found
Remind me my journey today at 8.15 pm	my journey
Remind to take money from Sarwar on 31st of December	take money from Sarwar
Call me at 6 am today	Call me
Greet day ahead all reminder close please	Not Found
Nothing just thanking you for the reminder	Not Found
Tell heena about vacancy in toi	Tell heena about vacancy
Remind me to send mail to moin at today 9.30pm	send mail to moin
Remind tomorrow of receipts at 2 pm	receipts
Please remind on 5th Jan to install Paytm at 9:10 am	install Paytm
Remind me to fill xat NMAT snap cat	fill xat NMAT snap cat
"Reminder label to be set as "" take practice manual of indirect tax """	take practice manual of indirect tax
Plz send a reminder on 05.12.16@10.15pm to take credit card from Hardik	take credit card from Hardik
Remind to pay esi	pay esi
Remind me book my movie tickets	book my movie tickets
Remind me to Check Discrete Maths MARKS	Check Discrete Maths MARKS
Set alarm at 6 am	Not Found
Remind me tomorrow at 10am for the dhoti order	for the dhoti order
Will you please remind me of making payment for stay to attendant before leaving for Airport. Time 03.45 pm today	making payment for stay to attendant
I want to set a reminder for my exam	my exam
Remind subash kamble at 5 today to check wooden flooring and door of e and f building	subash kamble and check wooden flooring and door of e and f building
Hey please remind me tommorow to complete my english (log book), maths ( assignments) and sst homework	complete my english (log book), maths ( assignments) and sst homework
My mom gave me tiffin for today's Dinner and tomorrow's Breakfast. Remind me to eat the tiffin today and tomorrow	eat the tiffin
I thot reminder ll speak up and make me aware...	speak up and make me aware...
Subject for a reminder?	Not Found
There is a small change in my reminder for tomorrow	There is a small change
Yes, i want reminder everyday	Not Found
Plz xxl all morning alarm for me	alarm for me
I have remind any other erson	any other erson
Remind me tomorrow at 9 pm about the test in parivarthana school at 1 30.	the test in parivarthana school
Reminder 3 for VAT on 1 July 2017	Not Found
Thank you for reminding me!	Not Found
I'm sorry but I have been receiving calls since morning, there hasn't been any issues yet! But anyways since this was the first time, I let go, else I'll have to delete the app! Coz my task got delayed now!	delete the app! Coz my task got delayed now!
Can i get information about how to apply or where to apply for passport?	apply or where to apply for passport
Remind me to take letter from neelam at 11am.	take letter from neelam
Set a reminder to make a school fees for drish and Neeryaan chheda on next Monday	make a school fees for drish and Neeryaan chheda
Remind me to take a portable charger tomorrow at 8:45 AM and 9:00 AM for Chandan	take a portable charger and Chandan
Remind me to picky my clothes today at 3 pm	picky my clothes
Call me five times	Not Found
Call me 5 times	Not Found
"Remind about ""Attendance"" on coming Sunday at 12pm"	Attendance
Call me once more at 8:30 am	Not Found
Remind me to check notes on 26 dec 11a.m	check notes on 26 dec 11a.m
Remind me to take my notes	take my notes
Remind me to sleep at 11:15	sleep
Remind me tomorrow that take clothes at 12 pm	take clothes
Can you plz remind me for exam	exam
Change scheduled today	Not Found
just give a missed call	give a missed call
Schedule it for every day from now on	Not Found
Can we link the reminder to some other mobile number	some other mobile number
Remind me to talk to my dad about bank	talk to my dad about bank
I wanna have a calling reminder	have a calling reminder
Remind me again at 6:40	Not Found
Remind me today evening for buying tablets	buying tablets
Keep alarm for 8:20pm	Keep alarm
reminder to practice ginan fr friday	practice ginan fr friday
Remind me to wash dishes after 1 hour	wash dishes
Dear Nalini can u pls remind me to wish Mr Prahlada for house warming on 4 dec at 11 am by cal..	wish Mr Prahlada for house warming on 4 dec
Remaind me 1:14	Not Found
And I have to meet Monisha at her store by 4:30. Remind me at 3:30.	meet Monisha at her store
Set a reminder to Watch Impractical Jokers at 11:40 am tomorrow	Watch Impractical Jokers
Reminder can be modified from 8 am to 11pm	Not Found
Remind me to check with aarti for the remaining documents at 10.30 am tomorrow	check with aarti for the remaining documents
Can we get a reminder on another number	another number
Remind me before 1 day	Not Found
P̉l̉z̉ s̉ẻt̉ ỉn̉ ủr̉ r̉ẻm̉ỉn̉d̉ẻr̉ t̉ỏ r̉ẻm̉ỉn̉d̉ m̉ẻ t̉h̉ảt̉ ỉ. H̉v̉ ả m̉ẻẻt̉ỉn̉g̉ b̉c̉z̉ t̉h̉ảt̉s̉ v̉ảr̉ỷ ỉm̉p̉ỏr̉t̉ản̉t̉. F̉ỏr̉ m̉ẻ	Not Found
Will u please tell me ur method of reminding	ur method of reminding
Call on 866 005 8991	Call
Call to starwear karkala today 01:00pm for payment confirmation	Call to starwear karkala and payment confirmation
Just make a reminder that i need to go shop for pamphlet around 3.00 pm	go shop for pamphlet
Call me for two times continually	Not Found
The reminder data are stored in my phone or in your cloud ? Of I login to haptik in another phone, will i get reminders there too ?	data are stored and haptik and another phone, will i get reminders there too
What is this reminder for?	What and ?
Reminder me about laundry by 9pm	laundry
Shubham 6december 12:01am	Not Found
Remind me to go Airport at 10 am	go Airport
Remind me at 8.00 pm for shopping	Not Found
Can you remind me to study maths at 1 30	study maths
Set a reminder for coming wednesday 9 am to remind me test of parallelograms to be set	coming and test of parallelograms to be set
Please send msg reminder to my phone	my phone
Remind me to listen to 'Mogwai' today at 2pm.	Mogwai'
Hey, can you remind me about something?	something
Change the time interval... 6.15 am and 6.30 am...set it accordingly	Change the time interval
I need to set some reminders	set some reminders
Hi i need a reminder for lunch	lunch
Set me alarm of 9:30am	Not Found
Remind me to cm in at 11:40	cm
Can you call me on 9886231012?!	Not Found
Riddhi set an remainder plz	Not Found
Call AK SIL Monday 14/11/2016 AT 11 AM	Not Found
Reminder to catch my train	catch my train
I have to submit photograph to presidency school,please remind me.	submit photograph to presidency school
Thanks Srushti	Not Found
Ya.. and remind me to get the documents arrested on that day...	get the documents arrested
Remind me today at 12:25 to pay my bills	pay my bills
Your name reminded me of sumone very special	sumone very special
Please remind me to recharge my cell today	recharge my cell
Hi can you remind me on 7th Oct at 2.30 pm to carry money for bus tickets	carry money for bus tickets
"Remind me to watch ""Modhati pellichoopulu"" at 5pm today"	"watch ""Modhati pellichoopulu"
Set alram	Not Found
Hi please give me a reminder on next Monday 8:45 Am To take documents for Zeus's GST registration	take documents for Zeus's GST registration
ya..	ya
Remind me to cut my nails	cut my nails
Nd also add a note that i want to ask ger about vikas	ask ger about vikas
10.30am to attend to Publication job 11.30am to attend PG exams job 12 30pm to go to the Construction site	attend to Publication job and attend PG exams job and go to the Construction site
Will u change the time of these reminders	u change the time of these reminders
I set remainder	Not Found
Remind me close for iron	close for iron
Can u plz postpone that reminder to Monday??	Not Found
Can u plz call again at 7:45	Not Found
Can you set a reminder that reminds me every day after tomorrow means leaving a day?	reminds me and means leaving a day
Hi give me a reminder to take passport by tonight 9 pm	take passport by
Can you remind me on SANKASHTI CHATURTHI of every month?	Not Found
Will get back to u ty reshma..	u ty reshma..
Remind me to fill company forms at 10:30pm today	fill company forms
And set a reminder of 6:35 today	Not Found
Can you hlp me about recharge ??	recharge ??
I want to start reminder from 8am	start reminder from 8am
Hye thanks for sharing this link,.. already I said about your aap to my friends	sharing this link,.. already I said about your aap to my friends
I want to know about CIA course	know about CIA course
Thanks for your reminder	Not Found
Will it ring repeatedly ?	Not Found
You forgot the 6pm reminder	Not Found
Remind me at 10 am	Not Found
Broh set a reminder for me to check out the notes at 9	check out the notes
Remind me to buy 3 packets of falahari for satyaki tomorrow at 10.30 am and again at 11am and then 12pm	buy 3 packets of falahari for satyaki and 10.30 am and again
Reminder at 9 pm	Not Found
Wish Birthday Name: Anniversary Date: December 6, 2016 Time: 12 00 AM	Not Found
Remind me to kiss u	kiss u
Thank you deepika. You made my day.	Thank you deepika. You made my day
Can I change the name of my reminder	Not Found
Delete all my alarm for tomorrow	Delete all my alarm
one more reminder set	Not Found
Please remind me everyday to take tablets at 3 in the afternoon	take tablets
Who will call at 9.15?	Who will call
Remind to book conference room on 15 nov at 10:30 am	book conference room
How to close reminders	close reminders
Hey...pls remind me to wash scuty on 4 jan. At 11 AM	wash scuty on 4 jan.
Can i get the remainders offline	Not Found
When did I tell u ppl to start my reminder s from 2am	start my reminder s
Remind me to buy milk at 7:22	buy milk
Call me at 9:10 A.M	Not Found
Please also remind me to have dry fruits and salad at 11 am everyday	have dry fruits and salad
Nd i want remainders after every 2 hrs...as tommorrow is my paper	Nd i want remainders
Remind 5.50 today's	Not Found
Remind me about pf at 1	pf
Can 7 reset the reminder for 7 pm	Not Found
U ll remind me right?	Not Found
I want to drink coffee so remind me after 15 mins	drink coffee
Can u pls remind of getting a haircut tomorrow	getting a haircut
Remind me to take airticket printout at 6:30pm today please	take airticket printout
remind me to study the gastro system tomorrow at 7 pm	study the gastro system
I want to add one reminder	one reminder
Remind to order transcripts	order transcripts
Can you set previous remainder between 12 pm and 10 pm	Not Found
Need to send a reminder	send a reminder
Can you remind me everyday at 4 pm ??	Not Found
Hi Please remind me to have b12 daily at 9 pm for next 20 days. And d3 every Sunday at 9 pm for next 12 weeks	have b12 and d3
Thank you for the reminders.	Thank you for the reminders
Thanks for alert me	Not Found
Can u remind me once in 2 hours	Not Found
Reminder to attend marriage function of Rahul pareekhs younger brother on 30th November 2016	attend marriage function of Rahul pareekhs younger brother
Can you remind me about course registration on 4 Jan?	course registration
Remind me to pick cigerettes	pick cigerettes
Oh dear I forgot the paper clips! Could you give me a reminder of the same today at 9pm	Not Found
Call on 7676544991	Call
